{
  "$schema": "https://agent-project-os.org/schemas/agent-upgrade-proposal-v1.schema.json",
  "agent_id": "agent:service-pm", "approved_by": "agent:hr-approver",
  "candidate_release_id": "service-pm-v2", "created_at": "2026-08-18T00:00:00Z",
  "evaluation_id": "service-pm-v2", "proposal_id": "service-pm-v2",
  "proposed_by": "agent:service-pm", "protocol_version": "1.0",
  "reviewed_at": "2026-08-18T00:00:00Z", "status": "accepted"
}
